{
  "serverUUID": "9e8d7c6b-5a4f-4e3d-9c2b-1a0f9e8d7c6b",
  "playerAmount": 3,
  "onlineMode": 0,
  "platformVersion": "1.21.4",
  "javaVersion": "21.0.5",
  "osName": "Windows 11",
  "osArch": "amd64",
  "osVersion": "10.0",
  "coreCount": 12,
  "service": {
    "id": 5501,
    "version": "0.9.1+1.21.4",
    "charts": [
      {
        "chartId": "loader_flavor",
        "data": { "value": "quilt" }
      }
    ]
  }
}
