{
  "serverUUID": "3f2b1c4d-5e6f-4a7b-8c9d-0e1f2a3b4c5d",
  "playerAmount": 12,
  "onlineMode": 1,
  "platformVersion": "git-Paper-196 (MC: 1.21.1)",
  "javaVersion": "21.0.4",
  "osName": "Linux",
  "osArch": "amd64",
  "osVersion": "6.1.0-18-amd64",
  "coreCount": 8,
  "service": {
    "id": 1234,
    "version": "1.0.0",
    "charts": []
  }
}
